{
  "schema_version": "1.0",
  "id": "20000000-0000-4000-8000-000000000009",
  "tenant_id": "10000000-0000-4000-8000-000000000001",
  "manager_user_id": "40000000-0000-4000-8000-000000000001",
  "conversation_thread_id": "20000000-0000-4000-8000-000000000004",
  "sales_case_id": null,
  "assigned_at": "2026-07-12T08:25:00.000Z"
}
